{
  "schema_version": "1.0",
  "dataset_id": "rider-semantic-decision-pilot-v1",
  "project": "the-rider",
  "status": "adjudicated",
  "created_at": "2026-10-03",
  "purpose": "Measure semantic copy-similarity and claim-support decisions beyond the deterministic Phase 10 baseline. Labels frozen after two blinded reviews and explicit disagreement adjudication.",
  "deidentification": {
    "contains_personal_contact_data": false,
    "method": "Uses public-facing project language and synthetic evaluation text only; agent names, phone numbers, email addresses, credentials, and private campaign records are excluded."
  },
  "label_policy": {
    "copy_similarity": "Label meaning as distinct, related-distinct, or equivalent; action reflects cross-surface repetition risk after any explicit approved reuse.",
    "claim_support": "Label whether the supplied excerpt supports the claim without adding unstated certainty, scope, timing, or superlatives.",
    "review_rule": "All labels are maintainer-seeded and provisional until independent review and adjudication are recorded. Holdout cases are not used to tune questions or thresholds."
  },
  "cases": [
    {
      "id": "sim-cal-001",
      "task": "copy-similarity",
      "split": "calibration",
      "state": {
        "left": "Same routine. Same membership.",
        "right": "Same routine. Same membership.",
        "context": "Two separate visible body modules in one email.",
        "approved_reuse": false
      },
      "expected": {
        "semantic_relation": "equivalent",
        "action": "block",
        "intentional_refrain": false
      },
      "challenge_tags": [
        "exact-duplicate",
        "cross-surface"
      ],
      "provenance": {
        "kind": "test-derived",
        "reference": "tests/test_rider_copy_allocation.py",
        "notes": "Reference repetition failure adapted from the wellness campaign."
      },
      "adjudication": {
        "status": "adjudicated",
        "reviewer_labels": [
          {
            "reviewer_id": "reviewer-a",
            "label": "equivalent",
            "action": "block",
            "intentional_refrain": false
          },
          {
            "reviewer_id": "reviewer-b",
            "label": "equivalent",
            "action": "block",
            "intentional_refrain": false
          }
        ]
      }
    },
    {
      "id": "sim-cal-002",
      "task": "copy-similarity",
      "split": "calibration",
      "state": {
        "left": "The wellness routine now travels with you in Miami every day.",
        "right": "The wellness routine now travels with you in Miami each day.",
        "context": "Adjacent body sections.",
        "approved_reuse": false
      },
      "expected": {
        "semantic_relation": "equivalent",
        "action": "block",
        "intentional_refrain": false
      },
      "challenge_tags": [
        "near-duplicate",
        "lexical-easy"
      ],
      "provenance": {
        "kind": "test-derived",
        "reference": "tests/test_rider_copy_allocation.py",
        "notes": "Existing lexical blocking fixture."
      },
      "adjudication": {
        "status": "adjudicated",
        "reviewer_labels": [
          {
            "reviewer_id": "reviewer-a",
            "label": "equivalent",
            "action": "block",
            "intentional_refrain": false
          },
          {
            "reviewer_id": "reviewer-b",
            "label": "equivalent",
            "action": "block",
            "intentional_refrain": false
          }
        ]
      }
    },
    {
      "id": "sim-cal-003",
      "task": "copy-similarity",
      "split": "calibration",
      "state": {
        "left": "Keep the wellness membership you already use when you move to Miami.",
        "right": "Your familiar club access can continue in your new city.",
        "context": "Hero support line and concluding body line.",
        "approved_reuse": false
      },
      "expected": {
        "semantic_relation": "equivalent",
        "action": "block",
        "intentional_refrain": false
      },
      "challenge_tags": [
        "semantic-paraphrase",
        "low-lexical-overlap"
      ],
      "provenance": {
        "kind": "brief-derived",
        "reference": "Rider wellness campaign brief",
        "notes": "De-identified paraphrase pair created for semantic-gap evaluation."
      },
      "adjudication": {
        "status": "adjudicated",
        "reviewer_labels": [
          {
            "reviewer_id": "reviewer-a",
            "label": "equivalent",
            "action": "review",
            "intentional_refrain": false
          },
          {
            "reviewer_id": "reviewer-b",
            "label": "equivalent",
            "action": "block",
            "intentional_refrain": false
          }
        ]
      }
    },
    {
      "id": "sim-cal-004",
      "task": "copy-similarity",
      "split": "calibration",
      "state": {
        "left": "A recovery-focused fitness space supports the start of the day.",
        "right": "Valet arrival keeps the transition home simple.",
        "context": "Separate amenity and arrival body modules.",
        "approved_reuse": false
      },
      "expected": {
        "semantic_relation": "distinct",
        "action": "allow",
        "intentional_refrain": false
      },
      "challenge_tags": [
        "different-topics",
        "lexical-easy"
      ],
      "provenance": {
        "kind": "synthetic",
        "reference": "Phase 13 seed set",
        "notes": "Distinct project-relevant messages."
      },
      "adjudication": {
        "status": "adjudicated",
        "reviewer_labels": [
          {
            "reviewer_id": "reviewer-a",
            "label": "distinct",
            "action": "allow",
            "intentional_refrain": false
          },
          {
            "reviewer_id": "reviewer-b",
            "label": "distinct",
            "action": "allow",
            "intentional_refrain": false
          }
        ]
      }
    },
    {
      "id": "sim-cal-005",
      "task": "copy-similarity",
      "split": "calibration",
      "state": {
        "left": "Soho House continues investing in its Beach House presence.",
        "right": "Equinox is preparing a new Edgewater club nearby.",
        "context": "Two list items supporting one neighborhood-wellness theme.",
        "approved_reuse": false
      },
      "expected": {
        "semantic_relation": "related-distinct",
        "action": "allow",
        "intentional_refrain": false
      },
      "challenge_tags": [
        "shared-theme",
        "different-facts"
      ],
      "provenance": {
        "kind": "fixture-derived",
        "reference": "projects/the-rider/skills/onbrand-the-rider-email/examples/rider-wellness-smoke.runtime.json",
        "notes": "Condensed from separate approved fixture statements."
      },
      "adjudication": {
        "status": "adjudicated",
        "reviewer_labels": [
          {
            "reviewer_id": "reviewer-a",
            "label": "related-distinct",
            "action": "allow",
            "intentional_refrain": false
          },
          {
            "reviewer_id": "reviewer-b",
            "label": "related-distinct",
            "action": "allow",
            "intentional_refrain": false
          }
        ]
      }
    },
    {
      "id": "sim-cal-006",
      "task": "copy-similarity",
      "split": "calibration",
      "state": {
        "left": "Same routine.",
        "right": "Same routine.",
        "context": "A deliberately repeated campaign refrain with an approved exemption naming both placements.",
        "approved_reuse": true
      },
      "expected": {
        "semantic_relation": "equivalent",
        "action": "allow",
        "intentional_refrain": true
      },
      "challenge_tags": [
        "approved-refrain",
        "policy-context"
      ],
      "provenance": {
        "kind": "test-derived",
        "reference": "tests/test_rider_copy_allocation.py",
        "notes": "Existing approved-refrain behavior."
      },
      "adjudication": {
        "status": "adjudicated",
        "reviewer_labels": [
          {
            "reviewer_id": "reviewer-a",
            "label": "equivalent",
            "action": "allow",
            "intentional_refrain": true
          },
          {
            "reviewer_id": "reviewer-b",
            "label": "equivalent",
            "action": "allow",
            "intentional_refrain": true
          }
        ]
      }
    },
    {
      "id": "sim-cal-007",
      "task": "copy-similarity",
      "split": "calibration",
      "state": {
        "left": "Wellness, minutes from home.",
        "right": "See how familiar memberships can fit your Miami routine.",
        "context": "Subject line and preview text; preview should extend rather than repeat the subject.",
        "approved_reuse": false
      },
      "expected": {
        "semantic_relation": "related-distinct",
        "action": "allow",
        "intentional_refrain": false
      },
      "challenge_tags": [
        "subject-preview",
        "complementary-copy"
      ],
      "provenance": {
        "kind": "synthetic",
        "reference": "projects/the-rider/skills/onbrand-the-rider-email/references/copy-quality.md",
        "notes": "Tests subject-preview complementarity."
      },
      "adjudication": {
        "status": "adjudicated",
        "reviewer_labels": [
          {
            "reviewer_id": "reviewer-a",
            "label": "related-distinct",
            "action": "allow",
            "intentional_refrain": false
          },
          {
            "reviewer_id": "reviewer-b",
            "label": "related-distinct",
            "action": "allow",
            "intentional_refrain": false
          }
        ]
      }
    },
    {
      "id": "sim-cal-008",
      "task": "copy-similarity",
      "split": "calibration",